Name,Page URL,Category,Location,Phone Number,Email,Website URL
Awakening Coffee Shop ,https://www.facebook.com/AwakeningCoffeeShop,Coffee shop,"56 Lyon Avenue, New York, NY, United States, New York",None,melvinoksborne@yahoo.com,None
Coffee SHOP ,https://www.facebook.com/bilal.coffeeshop,Coffee shop,"151 HINDON VIHAR, Ghaziabad, India, Uttar Pradesh",+91 75038 75786,bilalred2115@gmail.com,None
Coffee Shop ,https://www.facebook.com/Coffeeshopstore1,Website,None,None,None,coffeeshopstore.com
The Coffee Shop ,https://www.facebook.com/TheCoffeeShopTH,Tea Room,"226 Y Block, Phase 3, DHA, Lahore, Pakistan",0307 7788879,None,None
Coffee Shop ,https://www.facebook.com/coffeeshoplhe,Restaurant,"Lahore, Lahore, Pakistan",0333 1234567,None,None
Coffee Shop Lovers ,https://www.facebook.com/CoffeeShopLvers,Website,None,None,None,coffeeshoplovers.com
Coffee SHOP ,https://www.facebook.com/CoffeeShopSaintKitts,Coffee shop,"Port Zante , Basseterre, Saint Kitts and Nevis",+1 869-466-9993,coffeeshopstkitts@gmail.com,None
The Coffee Shop - New Delhi ,https://www.facebook.com/thecoffeeshop.newdelhi,Coffee shop,"PVR Anupam Shopping Complex Ground Floor Shop no 8, Saket, Delhi, India, Delhi",+91 99322 04622,thecoffeeshopnewdelhi@gmail.com,thecoffeeshop.in
The Coffee Shop  ,https://www.facebook.com/TheCoffeeShopStanley,Coffee shop · Farmers Market · Live Music Venue,"115 E Main St, Stanley, VA, United States, Virginia",+1 540-778-1111,thecoffeeshop.stanley@gmail.com,coffeeshopllc.com
Coffeeshop Company Egypt ,https://www.facebook.com/CoffeeShopCompanyEgypt,Coffee shop,"بورسعيد: شارع الجمهورية- أمام مسجد السلام , Port Said, Egypt",None,None,coffeeshopcompany.com
Barista coffee shop ,https://www.facebook.com/barista777,Coffee shop,"Hotel Jewel's Barista coffee Co. Ltd near ndri chowk , Karnal, India, Haryana",+91 97291 16623,barista@hoteljewels.in,barista.co.in
Coffee shop ,https://www.facebook.com/romano.connelly,Restaurant,"#89 national highway barrio barretto, Olongapo, Philippines",+63 47 222 9350,None,None
Coffee Shop Owners UK ,https://www.facebook.com/profile.php?id=61554567658989,Coffee shop,None,None,None,facebook.com/groups/coffeeshopownersuk
Baristas Coffee Shop ,https://www.facebook.com/@BCSBaristascoffeeshop/,Coffee shop,"Gatthaghar, Bhaktapur, Nepal",+977 984-0699880,bcscoffeeshop@gmail.com,baristascoffeeschool.com.np
Infoga Coffee Shop ,https://www.facebook.com/profile.php?id=61553898373727,Cafe · Breakfast & Brunch Restaurant,"Model Town, Gujranwala, Pakistan",0315 1482342,hassan.nadeem.exp@gmail.com,None
Coffee Shop ,https://www.facebook.com/profile.php?id=100066551616162,Coffee shop,"coffee, Delhi, India, Delhi",+91 95603 54394,None,None
Justins Coffee Shop ,https://www.facebook.com/profile.php?id=100069035395182,Restaurant,None,0302 4092519,None,None
Coffee shop ,https://www.facebook.com/profile.php?id=100063923705384,Restaurant,None,0300 6248663,None,None
Coffee Shop ,https://www.facebook.com/profile.php?id=61553093485172,Food & Drink · Food delivery service · Restaurant,"Colombo, Bambalapitiya, Sri Lanka",+94 72 221 2925,coffeeitaly323@gmail.com,None
ABZ coffee shop ,https://www.facebook.com/profile.php?id=100066930841245,Coffee shop,"saidulajab, New Delhi, India, Delhi",+91 78378 74188,None,None
The Coffee Shop ,https://www.facebook.com/profile.php?id=100083106673938,Coffee shop,"Residency Road, Srinagar, Srinagar, India, Jammu and Kashmir",+1 979-691-0555,wasimsikandar87@gmail.com,None
Lovelocks Coffee Shop ,https://www.facebook.com/LovelocksCoffeeShop,Coffee shop,"27 Old Haymarket, Liverpool, United Kingdom",None,None,lovelocks.coffee
Coffee Shop ,https://www.facebook.com/profile.php?id=61559969812625,Coffee shop,516 Laurel Lane,+94 74 228 6385,amazonap7@gmail.com,None
Streetcar Station Coffee Shop ,https://www.facebook.com/StreetcarStationCoffeeShop,Coffee shop,"515 S Main St, Galena, KS, United States, Kansas",+1 620-783-5554,None,streetcarstation.com
CoffeeShop ,https://www.facebook.com/InCoffeeShop.Coffee,Coffee shop,"New York, NY, United States, New York",None,Contact@incoffeeshop.com,incoffeeshop.com
Al Batra Restaurant & Coffee shop ,https://www.facebook.com/profile.php?id=100063938836170,Coffee shop,"Second Floor, AM Flores Building, 2 Constellation Street, Bel-Air 2, Makati, Philippines",None,None,albatrarestaurant.com
Coffee shop ,https://www.facebook.com/abhigupta5555,Movie,None,None,None,None
Irish Coffee Shop ,https://www.facebook.com/IrishCoffeeShop,Coffee shop,None,None,None,None
Indirock Coffee Shop ,https://www.facebook.com/indirockcoffeeshop,Coffee shop,"Indirock, Victoria Shopping Centre, Southend-on-Sea, United Kingdom",+44 1702 969988,hello@indirock.co.uk,indirock.co.uk
Coffee Shop Works ,https://www.facebook.com/profile.php?id=100063674702002,App page,None,None,None,itunes.apple.com/us/artist/coffee-shop-works/id379871723
Savories Coffee Shop ,https://www.facebook.com/savoriescoffee,Coffee shop,"2993 N Webb Rd, Wichita, KS, United States, Kansas",+1 316-239-4775,shawnsavories@yahoo.com,None
Ganesh-Baba Coffee Shop ,https://www.facebook.com/profile.php?id=100071501589000,Coffee shop,"Pune, India, Maharashtra",+91 97667 84672,None,None
Coffee Shop Usa ,https://www.facebook.com/profile.php?id=100075624413591,E-commerce website,None,None,None,None
Gemma's Coffee Shop ,https://www.facebook.com/Gemmascoffeeshop,Coffee shop,"11601 S Lacore Rd, Empire, MI, United States, Michigan",+1 231-326-2044,gemmasempire@yahoo.com,None
"Fran’s Cafe & Coffee Shop, LLC ",https://www.facebook.com/profile.php?id=100083224873129,Coffee shop,"48 County Road 134 Bruce, MS 38915, United States, Bruce, MS, United States, Mississippi",+1 662-983-5918,franscafeandcoffee@hotmail.com,None
The Nest Coffee Shop ,https://www.facebook.com/TheNestCoffeeShop,Coffee shop,"St John's Cathedral, 4-8 Garden Road, Tsim Sha Tsui, Hong Kong",None,theneststandrews@gmail.com,nesbittcentre.org.hk
Vickery's Coffee Shop & Restaurant ,https://www.facebook.com/VickerysCoffeeShop,Coffee shop,"Vickery Seedlings, Main Road, Malkerns, Swaziland",+268 7867 7696,kinny7509@gmail.com,None
Central Park Coffee Shop ,https://www.facebook.com/profile.php?id=100057534845582,Coffee shop,"51 McLelland Drive, Kilmarnock, United Kingdom",+44 1563 550265,centralparkcoffeeshop@gmail.com,central-park-coffee-shop.co.uk
Coffee Shop ,https://www.facebook.com/borocoffeeshop,Coffee shop,"276 Linthorpe Road, Middlesbrough, TS1 3QS, United Kingdom, Middlesbrough, United Kingdom",+44 7907 004090,None,borocafe.co.uk
Coffee Shop Experts ,https://www.facebook.com/profile.php?id=100081457577632,Coffee shop,"Vista, CA, United States, California",+1 866-512-6748,None,advanced-fabrication.com
Harvest Coffee Shop ,https://www.facebook.com/HarvestCoffeeShop,Coffee shop,"3/53 Yanyula Drive, Darwin, NT, Australia, Northern Territory",+61 8 8927 3178,harvest.anula@gmail.com,harvestcoffeeshop.com
Beachside Coffee Shop ,https://www.facebook.com/Beachside21,Coffee shop,"3, Cowell street , Llanelli, United Kingdom",+44 1554 897362,Beachsidecoffeeshop2020@gmail.com,None
Cocomo Coffee Shop ,https://www.facebook.com/cocomocoffeeshop,Coffee shop,"Liverpool, United Kingdom",None,None,None
Coffee Shop ,https://www.facebook.com/profile.php?id=100066805926948,Local business,"Forest Avenue, Palo Alto, CA, United States, California",None,None,None
Grounded Coffee Shop ,https://www.facebook.com/GroundedCoffeeALX,Coffee shop,"6919 Telegraph Road, Alexandria, VA, United States, Virginia",+1 703-341-6612,cafecitoamore20@gmail.com,groundedcoffeeshop.com
Coffee Shop Designs ,https://www.facebook.com/CaffeineShopDesignsMD,Shopping & retail,None,None,coffee.shop.designs.2018@gmail.com,etsy.com/shop/CoffeeShopDesignsMD
LIFT Coffee Shop & Cafe' ,https://www.facebook.com/profile.php?id=100063594429225,Coffee shop,"218 W Broad St, Richmond, VA, United States, Virginia",+1 804-344-5438,stephanie@liftcoffeeshop.com,liftcoffeeshop.com
Espresso coffee shop + Training center ,https://www.facebook.com/profile.php?id=100067615953196,Coffee shop,"Thapagaun, Lalitpur, Nepal",+977 984-9361711,None,None
Cheno's Coffee Shop ,https://www.facebook.com/Chenoscoffeehousecastara,Coffee shop,"North side, Castara, Trinidad and Tobago",+1 868-704-7819,None,castaracoffeehouse.com
Bee Hooi Coffee Shop ,https://www.facebook.com/BeeHooiCoffeeShop,Coffee shop,"415, Jalan Burma, George Town, Malaysia",None,chng012017@gmail.com,None
Jaccs Coffee Shop ,https://www.facebook.com/jaccscoffee,Coffee shop,"Unit 2 and 3 bullpond lane, Dunstable, United Kingdom",+44 1582 600060,coffee@live.co.uk,jaccscoffee.co.uk
Elgars Coffee Shop ,https://www.facebook.com/www.elgarscoffeeshop.co.uk,Coffee shop,"16 Reindeer Court, Worcester, United Kingdom",+44 1905 726977,musty@elgarscoffeeshop.co.uk,elgarscoffeeshop.co.uk
Luna Coffee Shop ,https://www.facebook.com/luna29cafe,Coffee shop,"121 W 29th St, New York, NY, United States, New York",+1 347-413-4032,lunacoffeeshop@gmail.com,Lunacoffeeshop.com
Justins Coffee shop ,https://www.facebook.com/profile.php?id=100070132097615,Coffee shop,None,0303 6574316,None,None
Mama's Coffee Shop with Callie Domingues ,https://www.facebook.com/MamasCoffeeShop,Writer,None,None,contact@mamascoffeeshop.info,mamascoffeeshop.info
Perks Coffee Shop ,https://www.facebook.com/perkscoffeegb,Coffee shop,"1216 Main St, Great Bend, KS, United States, Kansas",+1 620-786-2334,None,PerksCoffeeShop.com
"White Coffee Shop, Sur ",https://www.facebook.com/whitecoffeshopsur,Coffee shop,"Sur, Oman, Sur, Oman",+968 9232 5485,whitecoffeeshopsur@gmail.com,instagram.com/whitecoffeshopsur
Coffee Shop ,https://www.facebook.com/profile.php?id=100070278760080,Website,None,None,None,None
The Coffee Shop ,https://www.facebook.com/profile.php?id=100068111539842,Coffee shop,"421 N Woodland Blvd, DeLand, FL, United States, Florida",+1 386-822-8780,None,stetson.edu/administration/dining-services/index.php
The Coffee Shop ,https://www.facebook.com/italiancoffeeshop,Coffee shop,"ambalangoda, Hikkaduwa, Sri Lanka",+94 76 658 5247,thecoffeeshophikka@gmail.com,tripadvisor.com/Restaurant_Review-g304134-d2676678-Reviews-The_Coffee_Shop-Hikkaduwa_Galle_District_Southern_Province.html
Richard's Coffee Shop ,https://www.facebook.com/RichardsCoffeeShopMilitaryMuseum,Coffee shop,"165 N Main St, Mooresville, NC, United States, North Carolina",+1 704-663-0488,info@welcomevets.com,WelcomeVets.com
Ground Up Coffee Shop ,https://www.facebook.com/GroundUpBury,Coffee shop,"8 Market Street, Bury, United Kingdom",+44 161 526 4089,None,None
Keren Restaurant and Coffee Shop ,https://www.facebook.com/profile.php?id=100054505327545,Ethiopian Restaurant,"1780 Florida Ave NW, Washington D.C., DC, United States, Washington, District of Columbia",+1 202-265-5764,None,None
KCC coffee shop ,https://www.facebook.com/KCCcoffee,Coffee shop,"Triangle Building, Dunster avenue 60 Main Rd, Fish Hoek, Cape Town, 7975 (we are next to pep store) , Fishhoek, South Africa",+27 81 244 6931,kudzai@kcccoffee.co.za,kcccoffee.co.za
C & T Coffee Shop ,https://www.facebook.com/128.co.uk,Coffee shop,"62 upper Craig , Stirling, United Kingdom",+44 7880 557896,teresa128@hotmail.co.uk,Teresa-coffee-shop.ueniweb.com
Sufi Coffee Shop and Cultural Center ,https://www.facebook.com/profile.php?id=100068554740038,Coffee shop,"815 W El Camino Real, Mountain View, CA, United States, California",+1 650-962-9923,suficoffeeshop@sbcglobal.net,Suficoffeeshop.org
Zizinia Coffee shop ,https://www.facebook.com/ZiziniaCoffee,Coffee shop,"النعيمية 2 شارع الشيخ خليفة بن زايد ، قرب جسر غلفا, Al Ajman, United Arab Emirates",+971 50 849 9579,None,None
Beans Coffee Shop ,https://www.facebook.com/BeansDU,Coffee shop,"2044 E Evans Ave, Denver, CO, United States, Colorado",+1 303-871-2126,beanscoffeeshop1864@gmail.com,daniels.du.edu/faculty-research/hospitality-management/beans-coffee-shop
Environment Coffee Shop ,https://www.facebook.com/EScoffeeshop,Coffee shop,"University of Waterloo, Waterloo, ON, Canada, Ontario",+1 519-650-4545,environmentcoffeeshop@gmail.com,ess.uwaterloo.ca/coffee-shop
Vivace coffee shop ,https://www.facebook.com/vivace.uae,Chocolate Shop,"Dubai gold sock , Dubai, United Arab Emirates",+971 55 544 4254,None,None
The Coffee Shop Northeast ,https://www.facebook.com/theCSne,Coffee shop,"2852 Johnson St NE, Minneapolis, MN, United States, Minnesota",+1 612-259-8478,info@thecoffeeshopne.com,thecoffeeshopne.wordpress.com
Poppies Coffee Shop ,https://www.facebook.com/poppiesdavyhulme,Coffee shop,"11-13 Davyhulme Circle, Urmston, Manchester, Manchester, United Kingdom",+44 161 747 5645,poppiesdavyhulme@gmail.com,None
